Topic in Health,Responses for Topic in Health,Topic in Food,Responses for Topic in Food,Topic in Technology,Responses for Topic in Technology
Back pain,Back pain is a common condition that can be caused by a variety of factors.,Appetizer,A small dish served before a main meal.,Artificial intelligence (AI),AI is the ability of machines to perform tasks that normally require human intelligence.
Blood pressure,Blood pressure is the force of blood against the walls of your arteries.,Baking,The process of cooking food in an oven.,Blockchain,Blockchain is a distributed database that is shared among the nodes of a computer network.
Cholesterol,Cholesterol is a waxy substance found in your blood.,Barbecue,A method of cooking food over an open fire.,Cloud computing,Cloud computing is the delivery of computing services over the internet.
Diabetes,Diabetes is a chronic disease that affects how your body turns food into energy.,Beverage,A drink.,Computer vision,Computer vision is the ability of machines to understand and interpret images and videos.
Depression,Depression is a common mental health disorder that can cause persistent feelings of sadness and loss of interest.,Breakfast,The first meal of the day.,Cryptography,"Cryptography is the practice of protecting information from unauthorized access, use, disclosure, disruption, modification, or destruction."
Anxiety,"Anxiety is a normal and often healthy emotion. However, excessive anxiety can interfere with daily life.",Brunch,A combination of breakfast and lunch.,Cybersecurity,"Cybersecurity is the practice of protecting systems, networks, and data from cyber attacks."
Heart disease,Heart disease is the leading cause of death for both men and women in the United States.,Cake,"A sweet baked good typically made with flour, sugar, eggs, and butter.",Data science,Data science is the process of extracting knowledge or insights from data.
Stroke,"A stroke occurs when the blood supply to the brain is interrupted or reduced, depriving brain tissue of oxygen and nutrients.",Candy,"A sweet food typically made with sugar, butter, and/or chocolate.",Deep learning,Deep learning is a type of machine learning that uses artificial neural networks to learn from data.
Cancer,Cancer is a disease in which cells grow and divide uncontrollably.,Carbohydrate,A macronutrient that is the body's main source of energy.,Edge computing,"Edge computing is the processing of data at the edge of the network, close to where the data is generated."
Obesity,Obesity is a condition in which you have an excess amount of body fat.,Cheese,"A food product made from the curdled milk of cows, sheep, or goats.",Internet of Things (IoT),"The IoT is a network of physical objects that are embedded with sensors, software, and other technologies for the purpose of connecting and exchanging data with other devices and systems over the internet."
Alzheimer's disease,Alzheimer's disease is a progressive neurodegenerative disease that causes the brain to shrink and brain cells to die.,Chicken,A type of poultry that is often eaten as a meat.,Machine learning,Machine learning is a type of artificial intelligence (AI) that allows software applications to become more accurate in predicting outcomes without being explicitly programmed to do so. Machine learning algorithms use historical data as input to predict new output values.
Parkinson's disease,"Parkinson's disease is a progressive neurodegenerative disease that causes tremors, stiffness, and slowness of movement.",Chocolate,A sweet food product made from the cacao bean.,Natural language processing (NLP),NLP is a field of computer science that deals with the interaction between computers and human (natural) languages.
Migraine,"A migraine is a severe headache that can be accompanied by other symptoms, such as nausea, vomiting, and sensitivity to light and sound.",Coffee,A beverage made from roasted coffee beans.,Quantum computing,Quantum computing is a type of computing that uses the principles of quantum mechanics to perform computation.
Headache,A headache is a pain in the head that can be caused by a variety of factors.,Condiment,A substance added to food to enhance its flavor.,Robotics,"Robotics is the branch of technology that deals with the design, construction, operation, and application of robots."
Allergies,"Allergies are a hypersensitive reaction to an allergen, such as pollen, dust mites, or pet dander.",Cookie,"A small, sweet baked good typically made with flour, sugar, eggs, and butter.",Semiconductors,Semiconductors are materials that have electrical conductivity between that of a conductor and an insulator.
Asthma,Asthma is a chronic condition that affects the airways in your lungs.,Dessert,A sweet dish typically served at the end of a meal.,Software as a service (SaaS),SaaS is a software delivery model in which software is licensed on a subscription basis and is centrally hosted.
Arthritis,Arthritis is a condition that causes inflammation and pain in the joints.,Dinner,The main meal of the day.,Virtual reality (VR),VR is a simulated experience that can be similar to or completely different from the real world.
Cold and flu,"The common cold and the flu are respiratory illnesses that can cause a variety of symptoms, such as a runny nose, sore throat, cough, and fever.",Egg,"A food product made from the egg of a bird, typically a chicken.",Augmented reality (AR),"A technology that superimposes a computer-generated image on a user's view of the real world, thus providing a composite view."
Constipation,Constipation is a condition in which you have difficulty passing stool.,Fat,A macronutrient that is essential for energy storage and hormone production.,Mixed reality (MR),A hybrid of virtual reality and augmented reality that merges real and virtual worlds to produce new environments and visualizations where physical and digital objects co-exist and interact in real time.
Cough,A cough is a reflex that helps to clear the airways of mucus and other irritants.,Fish,A cold-blooded vertebrate animal that lives in water.,Extended reality (XR),"A catch-all term for virtual reality, augmented reality, and mixed reality."
Diarrhea,"Diarrhea is a condition in which you have loose, watery stools.",Flour,"A powder made from ground grain, typically wheat.",Wearable technology,Electronic devices that are worn on the body.
Eczema,"Eczema is a skin condition that causes dry, itchy skin.",Fruit,The sweet and fleshy product of a tree or other plant that contains seed and can be eaten as food.,Head-mounted display (HMD),A device that displays a computer-generated image in front of the user's eyes.
Fever,A fever is a rise in body temperature above normal.,Herb,A plant or part of a plant used for its medicinal or flavoring properties.,Haptic feedback,"A technology that creates a sense of touch by applying forces, vibrations, or motions to the user."
Food poisoning,Food poisoning is an illness caused by eating contaminated food.,Ice cream,"A frozen dessert made from milk, cream, sugar, and flavorings.",360-degree video,A video that is recorded with a camera that captures a full 360-degree field of view.
Heartburn,Heartburn is a burning sensation in the chest that can be caused by stomach acid backing up into the esophagus.,Juice,The liquid extracted from fruit or vegetables.,Volumetric video,A video that captures and displays three-dimensional images.
Hypertension,"Hypertension, also known as high blood pressure, is a condition in which the force of blood against the artery walls is too high.",Lunch,The meal eaten in the middle of the day.,Spatial audio,A technology that creates a three-dimensional sound field.
Influenza,"Influenza, also known as the flu, is a respiratory illness caused by the influenza virus.",Meat,The flesh of an animal that is eaten as food.,Motion capture,A technology that records the movement of objects or people.
Insomnia,"Insomnia is a sleep disorder that is characterized by difficulty falling asleep, staying asleep, or getting enough sleep.",Milk,A white liquid produced by mammary glands of mammals.,Game engine,A software development environment that is used to create video games.
Migraine,"A migraine is a type of headache that is often accompanied by nausea, vomiting, and sensitivity to light and sound.",Noodles,"A long, thin strip of pasta made from wheat flour and water.",Social VR,Virtual reality experiences that are designed for social interaction.
Muscle ache,"Muscle ache is pain in the muscles that can be caused by a variety of factors, such as overuse, injury, or infection.",Nut,A dry fruit with a hard shell that contains an edible seed.,Enterprise VR,"Virtual reality experiences that are used for business purposes, such as training and simulation."
Nausea,Nausea is a feeling of wanting to vomit.,Oil,A fatty liquid that is typically extracted from plants or seeds.,VR therapy,"Virtual reality experiences that are used to treat medical conditions, such as phobias and chronic pain."
Obesity,Obesity is a condition in which you have an excess amount of body fat.,Pasta,"A food made from dough of durum wheat flour mixed with water or eggs, and formed into sheets or other shapes that are dried before cooking.",Software,A set of instructions that tells a computer what to do.
Osteoarthritis,Osteoarthritis is the most common type of arthritis and is caused by the wear and tear of the joints.,Pizza,"A savory dish of Italian origin consisting of a usually round, flattened base of leavened wheat-based dough topped with tomatoes, cheese, and often various other ingredients (such as anchovies, mushrooms, onions, olives, pineapple, meat, etc.), which is then baked at a high temperature, traditionally in a wood-fired oven.",Operating system,The software that controls the basic functions of a computer.
Pain,Pain is a sensation that is often described as unpleasant or uncomfortable.,Protein,A macronutrient that is essential for building and repairing tissues.,Application software,"The software that users interact with to perform specific tasks, such as word processing, web browsing, and playing games."
Pneumonia,"Pneumonia is an infection of the lungs that can cause a variety of symptoms, such as fever, cough, and difficulty breathing.",Recipe,A set of instructions for cooking a particular dish.,System software,The software that manages and supports the hardware and software of a computer system.
Sinus infection,"A sinus infection is an infection of the sinuses, which are air cavities in the skull.",Salad,"A dish consisting of a mixture of raw or cooked vegetables, often with other ingredients such as meat, fish, cheese, or nuts.",Programming language,A language used to write software.
Sore throat,"A sore throat is pain or scratchiness in the throat that can be caused by a variety of factors, such as a viral infection, bacterial infection, or allergies.",Salt,A mineral compound with the chemical formula NaCl.,Software development,The process of creating software.
Stomach flu,"The stomach flu is a viral infection that can cause a variety of symptoms, such as vomiting, diarrhea, and stomach cramps.",Sauce,A liquid or semisolid food served with other foods to enhance their flavor.,Software testing,The process of testing software to ensure that it meets its requirements and works as expected.
Sunburn,Sunburn is a painful condition of the skin that is caused by overexposure to the sun's ultraviolet (UV) rays.,Seafood,Any edible marine or freshwater animal.,Software deployment,The process of making software available to users.
Tonsillitis,"Tonsillitis is an inflammation of the tonsils, which are two masses of tissue at the back of the throat.",Snack,A small meal eaten between meals.,Software maintenance,The process of fixing bugs and improving software.
Urinary tract infection,A urinary tract infection (UTI) is an infection of the urinary tract.,Soup,"A liquid food made by boiling meat, fish, vegetables, or other ingredients in water or stock.",Software licensing,The process of granting users the right to use software.
Vaccination,The process of giving a person a vaccine to help them develop immunity to a disease.,Spice,"A dried seed, fruit, root, or bark used to flavor food.",Open-source software,Software that is freely available and can be modified and redistributed.
Vision,The ability to see.,Sugar,A sweet substance that is often used to sweeten food.,Proprietary software,Software that is owned by a company and is not freely available.
Weight loss,The process of reducing the amount of body fat.,Tea,A beverage made from the cured leaves of the Camellia sinensis plant.,Free software,Software that is available for free.
Women's health,The branch of medicine that deals with the health and well-being of women.,Tofu,A food made by curdling soy milk and pressing it into solid blocks.,Freemium software,Software that is available for free with basic features and premium features that can be purchased.
Men's health,The branch of medicine that deals with the health and well-being of men.,Tomato,A red fruit that is often eaten as a vegetable.,Subscription software,Software that is available for a monthly or annual subscription fee.
Children's health,The branch of medicine that deals with the health and well-being of children.,Turkey,A type of poultry that is often eaten as a meat.,Software development tools,"Tools that help software developers to write, test, and deploy software."
Mental health,"The state of our emotional, psychological, and social well-being.",Vegetable,A plant or part of a plant that is eaten as food.,Software version control,A system for tracking changes to software code.
Nutrition,"The branch of science that deals with the nutrients that our bodies need for growth, development, and maintenance.",Vegan,A person who does not eat any animal products.,Software build automation,The process of automating the building of software.
Exercise,Any bodily activity that enhances or maintains physical fitness and overall health and wellness.,Vegetarian,"A person who does not eat meat, poultry, or fish.",Software testing tools,Tools that help software testers to test software.
